{
  "$schema": "https://json-schema.org/draft/2020-12/schema",
  "$id": "oreflow-validation-v2",
  "title": "oreflow-validation-v2",
  "type": "object",
  "properties": {
    "schema": {
      "const": "oreflow.validation/v2",
      "type": "string"
    },
    "engine_version": {
      "type": "string"
    },
    "contract_digest": {
      "type": "string"
    },
    "passed": {
      "type": "boolean"
    },
    "errors": {
      "type": "array"
    },
    "stages": {
      "type": "array"
    },
    "workers": {
      "type": "integer"
    },
    "seconds": {
      "type": "object"
    }
  },
  "required": [
    "schema",
    "engine_version",
    "contract_digest",
    "passed",
    "errors",
    "stages",
    "workers",
    "seconds"
  ],
  "additionalProperties": true
}
