{"schema":"oreflow.validation/v2","engine_version":"0.10.000","contract_digest":"0d2b65d272f3abcc6adffbf0f734c985cb002ab5cb665c109b8e8e9e31cecbd7","passed":true,"errors":[],"stages":["contract","learning","cases","benchmark","studies","real_samples","manifests","validation"],"workers":4,"seconds":{"contract":0.8703412000031676,"learning":3590.0506311999998,"cases":2892.6817198999997,"benchmark":0.630510900002264,"studies":238.8935330000022,"real_samples":107.01888410000538,"manifests":0.1145027000020491,"validation":0.618821800002479}}